{
	"$schema": "../../schemas/code-crispies-module-schema.json",
	"id": "transitions-animations",
	"title": "Animacje CSS",
	"description": "Dodaj interaktywność do interfejsu poprzez płynne przejścia właściwości i animacje oparte na keyframes.",
	"difficulty": "intermediate",
	"lessons": [
		{
			"id": "transitions-1",
			"title": "Transitions",
			"description": "Naucz się jak stosować <kbd>transition</kbd> do właściwości dla płynnych zmian przy zmianie stanu.<br><br><pre>transition: property duration;\n/* np. transition: background-color 0.3s; */</pre>",
			"task": "Dodaj <kbd>transition: background-color 0.3s</kbd>, aby kolor płynnie zmieniał się przy hover.",
			"previewHTML": "<button class=\"btn\">Hover Me</button>",
			"previewBaseCSS": "body { font-family: sans-serif; padding: 1rem; } .btn { background: black; color: white; padding: 0.5rem 1rem; border: none; cursor: pointer; } .btn:hover { background: white; color: black; }",
			"sandboxCSS": "",
			"codePrefix": "/* Add transition */\n.btn {",
			"initialCode": "",
			"codeSuffix": "}",
			"solution": "  transition: background-color 0.3s;",
			"previewContainer": "preview-area",
			"validations": [
				{
					"type": "contains",
					"value": "transition",
					"message": "Użyj właściwości <kbd>transition</kbd>",
					"options": { "caseSensitive": false }
				},
				{
					"type": "regex",
					"value": "transition:\\s*background-color\\s*0\\.3s",
					"message": "Ustaw <kbd>transition: background-color 0.3s</kbd>",
					"options": { "caseSensitive": false }
				}
			]
		},
		{
			"id": "transitions-2",
			"title": "Timing Funcs",
			"description": "Poznaj funkcje easing jak <kbd>ease</kbd>, <kbd>linear</kbd>, <kbd>ease-in</kbd>, <kbd>ease-out</kbd> do kontrolowania tempa animacji.",
			"task": "Ustaw <kbd>transition-timing-function</kbd> na <kbd>ease-in-out</kbd>.",
			"previewHTML": "<button class=\"btn\">Timing</button>",
			"previewBaseCSS": "body { font-family: sans-serif; padding: 1rem; } .btn { background: navy; color: gold; padding: 0.5rem 1rem; border: none; cursor: pointer; transition: all 0.5s; } .btn:hover { background: gold; color: navy; transform: scale(1.1); }",
			"sandboxCSS": "",
			"codePrefix": "/* Set timing function */\n.btn {",
			"initialCode": "",
			"codeSuffix": "}",
			"solution": "  transition-timing-function: ease-in-out;",
			"previewContainer": "preview-area",
			"validations": [
				{
					"type": "contains",
					"value": "transition-timing-function",
					"message": "Użyj <kbd>transition-timing-function</kbd>",
					"options": { "caseSensitive": false }
				},
				{
					"type": "property_value",
					"value": { "property": "transition-timing-function", "expected": "ease-in-out" },
					"message": "Ustaw timing na <kbd>ease-in-out</kbd>"
				}
			]
		},
		{
			"id": "transitions-3",
			"title": "Keyframes",
			"description": "Twórz nazwane animacje używając <kbd>@keyframes</kbd> i stosuj je przez skrót <kbd>animation</kbd>.<br><br><pre>@keyframes bounce {\n  50% { transform: translateY(-20px); }\n}\n.ball {\n  animation: bounce 1s infinite;\n}</pre>",
			"task": "Zdefiniuj keyframe przy <kbd>50%</kbd> z <kbd>transform: translateY(-20px)</kbd> i zastosuj <kbd>animation: bounce 1s infinite</kbd> na <kbd>.ball</kbd>.",
			"previewHTML": "<div class=\"ball\"></div>",
			"previewBaseCSS": "body { font-family: sans-serif; padding: 1rem; } .ball { width: 50px; height: 50px; background: crimson; border-radius: 50%; margin: 2rem auto; }",
			"sandboxCSS": "",
			"codePrefix": "/* Define keyframes and apply animation */\n@keyframes bounce {",
			"initialCode": "",
			"codeSuffix": "}\n.ball { }",
			"solution": "  50% { transform: translateY(-20px); }\n}\n.ball {\n  animation: bounce 1s infinite;",
			"previewContainer": "preview-area",
			"validations": [
				{
					"type": "contains",
					"value": "@keyframes bounce",
					"message": "Zdefiniuj <kbd>@keyframes bounce</kbd>",
					"options": { "caseSensitive": false }
				},
				{
					"type": "regex",
					"value": "50%.*transform: translateY\\(-20px\\)",
					"message": "Przy <kbd>50%</kbd>, użyj <kbd>transform: translateY(-20px)</kbd>",
					"options": { "caseSensitive": false }
				},
				{
					"type": "contains",
					"value": "animation",
					"message": "Użyj właściwości <kbd>animation</kbd> na <kbd>.ball</kbd>",
					"options": { "caseSensitive": false }
				},
				{
					"type": "regex",
					"value": "animation:.*bounce.*1s.*infinite",
					"message": "Zastosuj <kbd>animation: bounce 1s infinite</kbd>",
					"options": { "caseSensitive": false }
				}
			]
		},
		{
			"id": "transitions-4",
			"title": "Animation Properties",
			"description": "Dostosuj animacje za pomocą <kbd>animation-delay</kbd>, <kbd>animation-iteration-count</kbd>, <kbd>animation-direction</kbd> i <kbd>animation-fill-mode</kbd>.",
			"task": "Zastosuj animację <kbd>pulse</kbd> na <kbd>.box</kbd> z <kbd>animation-name: pulse</kbd>, <kbd>animation-duration: 2s</kbd>, <kbd>animation-delay: 1s</kbd>, <kbd>animation-iteration-count: 2</kbd> i <kbd>animation-fill-mode: forwards</kbd>.",
			"previewHTML": "<div class=\"box\">Pulse</div>",
			"previewBaseCSS": "body { font-family: sans-serif; padding: 1rem; } .box { width: 100px; height: 100px; background: black; color: white; display: flex; align-items: center; justify-content: center; margin: 2rem auto; } @keyframes pulse { 0% { background: black; color: white; transform: scale(1); } 50% { background: white; color: black; transform: scale(1.2); } 100% { background: limegreen; color: black; transform: scale(1); } }",
			"sandboxCSS": "",
			"codePrefix": "/* Apply animation properties */\n.box {",
			"initialCode": "",
			"codeSuffix": "}",
			"solution": "  animation-name: pulse;\n  animation-duration: 2s;\n  animation-delay: 1s;\n  animation-iteration-count: 2;\n  animation-fill-mode: forwards;",
			"previewContainer": "preview-area",
			"validations": [
				{
					"type": "property_value",
					"value": { "property": "animation-name", "expected": "pulse" },
					"message": "Ustaw <kbd>animation-name: pulse</kbd>"
				},
				{
					"type": "property_value",
					"value": { "property": "animation-duration", "expected": "2s" },
					"message": "Ustaw <kbd>animation-duration: 2s</kbd>"
				},
				{
					"type": "property_value",
					"value": { "property": "animation-delay", "expected": "1s" },
					"message": "Ustaw <kbd>animation-delay: 1s</kbd>"
				},
				{
					"type": "property_value",
					"value": { "property": "animation-iteration-count", "expected": "2" },
					"message": "Ustaw <kbd>animation-iteration-count: 2</kbd>"
				},
				{
					"type": "property_value",
					"value": { "property": "animation-fill-mode", "expected": "forwards" },
					"message": "Ustaw <kbd>animation-fill-mode: forwards</kbd>"
				}
			]
		}
	]
}
