{
	"$schema": "../schemas/code-crispies-module-schema.json",
	"id": "css-positioning",
	"title": "CSS Positionierung",
	"description": "Steuere die Platzierung von Elementen mit CSS-Positionierungs-Eigenschaften.",
	"difficulty": "intermediate",
	"lessons": [
		{
			"id": "position-1",
			"title": "Relative Position",
			"description": "The <kbd>position</kbd> property controls how elements are placed. <kbd>relative</kbd> keeps the element in normal flow but allows you to offset it with <kbd>top</kbd>, <kbd>right</kbd>, <kbd>bottom</kbd>, <kbd>left</kbd>.<br><br><pre>.box {\n  position: relative;\n  top: 10px;\n}</pre>",
			"task": "Mach das Abzeichen relativ positioniert, damit wir es verschieben können.",
			"previewHTML": "<div class=\"card\"><span class=\"badge\">NEW</span><h3>Product</h3></div>",
			"previewBaseCSS": "body { font-family: system-ui, sans-serif; padding: 1rem; } .card { padding: 1rem; background: white; border: 2px solid #eee; border-radius: 8px; } .card h3 { margin: 0; } .badge { display: inline-block; padding: 2px 8px; background: coral; color: white; font-size: 0.7rem; font-weight: bold; border-radius: 4px; }",
			"sandboxCSS": "",
			"codePrefix": ".badge {\n  ",
			"initialCode": "",
			"codeSuffix": "\n}",
			"solution": "position: relative;",
			"previewContainer": "preview-area",
			"validations": [
				{
					"type": "property_value",
					"value": {
						"property": "position",
						"expected": "relative"
					},
					"message": "Setze <kbd>position: relative</kbd>"
				}
			]
		},
		{
			"id": "position-2",
			"title": "Versatz-Eigenschaften",
			"description": "With <kbd>position: relative</kbd>, use offset properties to nudge the element from its original position:<br><br><kbd>top</kbd> - pushes down from top<br><kbd>left</kbd> - pushes right from left<br><br>Negative values move in the opposite direction.",
			"task": "Verschiebe das Abzeichen nach oben mit <kbd>top: -8px</kbd>.",
			"previewHTML": "<div class=\"card\"><span class=\"badge\">NEW</span><h3>Product</h3></div>",
			"previewBaseCSS": "body { font-family: system-ui, sans-serif; padding: 1rem; } .card { padding: 1rem; background: white; border: 2px solid #eee; border-radius: 8px; } .card h3 { margin: 0; } .badge { display: inline-block; padding: 2px 8px; background: coral; color: white; font-size: 0.7rem; font-weight: bold; border-radius: 4px; position: relative; }",
			"sandboxCSS": "",
			"codePrefix": ".badge {\n  ",
			"initialCode": "",
			"codeSuffix": "\n}",
			"solution": "top: -8px;",
			"previewContainer": "preview-area",
			"validations": [
				{
					"type": "property_value",
					"value": {
						"property": "top",
						"expected": "-8px"
					},
					"message": "Setze <kbd>top: -8px</kbd>"
				}
			]
		},
		{
			"id": "position-3",
			"title": "Absolute Position",
			"description": "<kbd>position: absolute</kbd> removes the element from normal flow and positions it relative to its nearest positioned ancestor (or the viewport if none exists).<br><br>Always set a parent to <kbd>position: relative</kbd> to contain absolute children.",
			"task": "Positioniere den Schließen-Button absolut.",
			"previewHTML": "<div class=\"modal\"><button class=\"close\">×</button><h3>Modal</h3><p>Content here</p></div>",
			"previewBaseCSS": "body { font-family: system-ui, sans-serif; padding: 1rem; } .modal { position: relative; padding: 2rem; background: white; border-radius: 12px; box-shadow: 0 4px 24px rgba(0,0,0,0.15); max-width: 250px; } .modal h3 { margin: 0 0 8px; } .modal p { margin: 0; color: #666; } .close { width: 32px; height: 32px; border: none; background: #f5f5f5; border-radius: 50%; font-size: 1.2rem; cursor: pointer; }",
			"sandboxCSS": "",
			"codePrefix": ".close {\n  ",
			"initialCode": "",
			"codeSuffix": "\n}",
			"solution": "position: absolute;",
			"previewContainer": "preview-area",
			"validations": [
				{
					"type": "property_value",
					"value": {
						"property": "position",
						"expected": "absolute"
					},
					"message": "Setze <kbd>position: absolute</kbd>"
				}
			]
		},
		{
			"id": "position-4",
			"title": "Absolute Elemente platzieren",
			"description": "Combine <kbd>position: absolute</kbd> with offset properties to place elements precisely.<br><br><pre>.close {\n  position: absolute;\n  top: 8px;\n  right: 8px;\n}</pre>",
			"task": "Verschiebe den Schließen-Button in die obere rechte Ecke mit <kbd>top: 8px</kbd> und <kbd>right: 8px</kbd>.",
			"previewHTML": "<div class=\"modal\"><button class=\"close\">×</button><h3>Modal</h3><p>Content here</p></div>",
			"previewBaseCSS": "body { font-family: system-ui, sans-serif; padding: 1rem; } .modal { position: relative; padding: 2rem; background: white; border-radius: 12px; box-shadow: 0 4px 24px rgba(0,0,0,0.15); max-width: 250px; } .modal h3 { margin: 0 0 8px; } .modal p { margin: 0; color: #666; } .close { position: absolute; width: 32px; height: 32px; border: none; background: #f5f5f5; border-radius: 50%; font-size: 1.2rem; cursor: pointer; }",
			"sandboxCSS": "",
			"codePrefix": ".close {\n  ",
			"initialCode": "",
			"codeSuffix": "\n}",
			"solution": "top: 8px;\n  right: 8px;",
			"previewContainer": "preview-area",
			"validations": [
				{
					"type": "property_value",
					"value": {
						"property": "top",
						"expected": "8px"
					},
					"message": "Setze <kbd>top: 8px</kbd>"
				},
				{
					"type": "property_value",
					"value": {
						"property": "right",
						"expected": "8px"
					},
					"message": "Setze <kbd>right: 8px</kbd>"
				}
			]
		}
	]
}