{
	"$schema": "../../schemas/code-crispies-module-schema.json",
	"id": "html-elements",
	"title": "HTML Block & Inline",
	"description": "Comprende la diferencia fundamental entre elementos contenedores (bloque) y elementos en línea",
	"mode": "html",
	"difficulty": "beginner",
	"lessons": [
		{
			"id": "block-vs-inline-intro",
			"title": "Elementos de bloque vs en línea",
			"description": "Los elementos HTML se dividen en dos categorías principales:<br><br><strong>Elementos de bloque</strong> (contenedores) comienzan en una nueva línea y ocupan todo el ancho. Ejemplos: <kbd>&lt;div&gt;</kbd>, <kbd>&lt;p&gt;</kbd>, <kbd>&lt;h1&gt;</kbd>, <kbd>&lt;section&gt;</kbd><br><br><strong>Elementos en línea</strong> fluyen dentro del texto y solo ocupan el ancho necesario. Ejemplos: <kbd>&lt;span&gt;</kbd>, <kbd>&lt;a&gt;</kbd>, <kbd>&lt;strong&gt;</kbd>, <kbd>&lt;em&gt;</kbd>",
			"task": "Envuelve la palabra <kbd>importante</kbd> con etiquetas <kbd>&lt;strong&gt;</kbd> para ponerla en negrita. Observa cómo el párrafo (bloque) ocupa todo el ancho mientras que strong (en línea) fluye con el texto.",
			"previewHTML": "",
			"previewBaseCSS": "body { font-family: system-ui, sans-serif; padding: 20px; } p { background: #e3f2fd; padding: 10px; } strong { background: #ffecb3; }",
			"sandboxCSS": "",
			"initialCode": "<p>Este es un párrafo con una palabra importante.</p>",
			"solution": "<p>Este es un párrafo con una palabra <strong>importante</strong>.</p>",
			"previewContainer": "preview-area",
			"validations": [
				{
					"type": "element_exists",
					"value": "p",
					"message": "Añade un elemento de párrafo <kbd>&lt;p&gt;</kbd>"
				},
				{
					"type": "parent_child",
					"value": { "parent": "p", "child": "strong" },
					"message": "Envuelve la palabra <kbd>importante</kbd> con etiquetas <kbd>&lt;strong&gt;</kbd>"
				}
			]
		},
		{
			"id": "semantic-containers",
			"title": "Etiquetas semánticas",
			"description": "El HTML moderno usa contenedores semánticos que describen su contenido:<br><br><kbd>&lt;header&gt;</kbd> - Encabezado de página o sección<br><kbd>&lt;nav&gt;</kbd> - Enlaces de navegación<br><kbd>&lt;main&gt;</kbd> - Área de contenido principal<br><kbd>&lt;section&gt;</kbd> - Agrupación temática<br><kbd>&lt;article&gt;</kbd> - Contenido independiente<br><kbd>&lt;footer&gt;</kbd> - Pie de página o sección",
			"task": "Crea una estructura básica de página:<br>1. Añade un <kbd>&lt;header&gt;</kbd> con un <kbd>&lt;h1&gt;</kbd> que contenga el texto <code>Mi Sitio Web</code><br>2. Añade un elemento <kbd>&lt;main&gt;</kbd> con un párrafo que diga <code>¡Bienvenido a mi sitio!</code><br>3. Añade un <kbd>&lt;footer&gt;</kbd> con un párrafo que diga <code>Copyright 2026</code>",
			"previewHTML": "",
			"previewBaseCSS": "body { font-family: system-ui; margin: 0; } header { background: #1976d2; color: white; padding: 15px; } main { padding: 20px; min-height: 100px; } footer { background: #424242; color: white; padding: 10px; text-align: center; }",
			"sandboxCSS": "",
			"initialCode": "",
			"solution": "<header>\n  <h1>Mi Sitio Web</h1>\n</header>\n<main>\n  <p>¡Bienvenido a mi sitio!</p>\n</main>\n<footer>\n  <p>Copyright 2026</p>\n</footer>",
			"previewContainer": "preview-area",
			"validations": [
				{
					"type": "element_exists",
					"value": "header",
					"message": "Añade un elemento <kbd>&lt;header&gt;</kbd>"
				},
				{
					"type": "element_exists",
					"value": "main",
					"message": "Añade un elemento <kbd>&lt;main&gt;</kbd>"
				},
				{
					"type": "element_exists",
					"value": "footer",
					"message": "Añade un elemento <kbd>&lt;footer&gt;</kbd>"
				},
				{
					"type": "parent_child",
					"value": { "parent": "header", "child": "h1" },
					"message": "Añade un encabezado <kbd>&lt;h1&gt;</kbd> dentro de tu header"
				}
			]
		}
	]
}
