{
	"$schema": "../../schemas/code-crispies-module-schema.json",
	"id": "html-tables",
	"title": "HTML Tabellen",
	"description": "Erstelle strukturierte Datentabellen mit semantischem Markup",
	"mode": "html",
	"difficulty": "beginner",
	"lessons": [
		{
			"id": "table-basic",
			"title": "Datentabellen",
			"description": "Tabellen zeigen strukturierte Daten in Zeilen und Spalten. Verwende <kbd>&lt;table&gt;</kbd> als Container, <kbd>&lt;tr&gt;</kbd> für Zeilen, <kbd>&lt;th&gt;</kbd> für Kopfzellen und <kbd>&lt;td&gt;</kbd> für Datenzellen.<br><br>Füge <kbd>&lt;caption&gt;</kbd> hinzu für einen zugänglichen Titel, der den Tabelleninhalt beschreibt.",
			"task": "Erstelle eine Preistabelle:<br>1. Eine <kbd>&lt;caption&gt;</kbd> mit <code>Pricing</code><br>2. Eine Kopfzeile mit <code>Plan</code> und <code>Price</code><br>3. Zwei Datenzeilen für Basic ($9) und Pro ($29)",
			"previewHTML": "",
			"previewBaseCSS": "body { font-family: system-ui; padding: 20px; background: #f5f5f5; } table { border-collapse: collapse; width: 100%; max-width: 350px; background: white; border-radius: 12px; overflow: hidden; box-shadow: 0 4px 15px rgba(0,0,0,0.1); } caption { padding: 16px; font-weight: 600; font-size: 1.1rem; color: #333; background: #f8f9fa; } th, td { padding: 14px 20px; text-align: left; border-bottom: 1px solid #eee; } th { background: steelblue; color: white; font-weight: 500; } tr:last-child td { border-bottom: none; } tr:hover td { background: #f8f9fa; }",
			"sandboxCSS": "",
			"initialCode": "",
			"solution": "<table>\n  <caption>Pricing</caption>\n  <tr>\n    <th>Plan</th>\n    <th>Price</th>\n  </tr>\n  <tr>\n    <td>Basic</td>\n    <td>$9</td>\n  </tr>\n  <tr>\n    <td>Pro</td>\n    <td>$29</td>\n  </tr>\n</table>",
			"previewContainer": "preview-area",
			"validations": [
				{
					"type": "element_exists",
					"value": "table",
					"message": "Füge ein <kbd>&lt;table&gt;</kbd>-Element hinzu"
				},
				{
					"type": "element_exists",
					"value": "caption",
					"message": "Füge eine <kbd>&lt;caption&gt;</kbd> für den Tabellentitel hinzu"
				},
				{
					"type": "element_count",
					"value": { "selector": "th", "min": 2 },
					"message": "Füge Kopfzellen (<kbd>&lt;th&gt;</kbd>) für Plan und Price hinzu"
				},
				{
					"type": "element_count",
					"value": { "selector": "tr", "min": 3 },
					"message": "Füge 3 Zeilen hinzu (1 Kopf + 2 Datenzeilen)"
				}
			]
		}
	]
}
