{
	"$schema": "../../schemas/code-crispies-module-schema.json",
	"id": "html-forms-basic",
	"title": "HTML Форми",
	"description": "Навчіться створювати форми з різними типами полів",
	"mode": "html",
	"difficulty": "beginner",
	"lessons": [
		{
			"id": "form-structure",
			"title": "Структура форми",
			"description": "Кожна форма потребує обгортки <kbd>&lt;form&gt;</kbd>. Всередині використовуйте <kbd>&lt;label&gt;</kbd> для опису полів та <kbd>&lt;input&gt;</kbd> для введення даних.<br><br>Атрибут <kbd>for</kbd> у label має відповідати <kbd>id</kbd> полів для доступності.",
			"task": "Створіть форму з:<br>1. <kbd>&lt;label&gt;</kbd> з текстом <code>Ім'я:</code> та атрибутом <kbd>for=\"name\"</kbd><br>2. Текстовим <kbd>&lt;input&gt;</kbd> з атрибутами <kbd>id=\"name\"</kbd> та <kbd>name=\"name\"</kbd>",
			"previewHTML": "",
			"previewBaseCSS": "body { font-family: system-ui; padding: 20px; } form { max-width: 300px; } label { display: block; margin-bottom: 5px; font-weight: 500; } input { width: 100%; padding: 8px; border: 1px solid #ccc; border-radius: 4px; box-sizing: border-box; }",
			"sandboxCSS": "",
			"initialCode": "",
			"solution": "<form>\n  <label for=\"name\">Ім'я:</label>\n  <input type=\"text\" id=\"name\" name=\"name\">\n</form>",
			"previewContainer": "preview-area",
			"validations": [
				{
					"type": "element_exists",
					"value": "form",
					"message": "Оберніть все елементом <kbd>&lt;form&gt;</kbd>"
				},
				{
					"type": "element_exists",
					"value": "label",
					"message": "Додайте <kbd>&lt;label&gt;</kbd> для вашого поля"
				},
				{
					"type": "element_exists",
					"value": "input",
					"message": "Додайте елемент <kbd>&lt;input&gt;</kbd>"
				},
				{
					"type": "attribute_value",
					"value": { "selector": "label", "attr": "for", "value": null },
					"message": "Додайте атрибут <kbd>for</kbd> до вашого label"
				},
				{
					"type": "attribute_value",
					"value": { "selector": "input", "attr": "id", "value": null },
					"message": "Додайте атрибут <kbd>id</kbd> до вашого поля"
				}
			]
		},
		{
			"id": "input-types",
			"title": "Типи полів",
			"description": "Різні типи полів надають відповідні клавіатури та валідацію:<br><br><kbd>type=\"text\"</kbd> - Загальний текст<br><kbd>type=\"email\"</kbd> - Email з валідацією @<br><kbd>type=\"password\"</kbd> - Приховані символи<br><kbd>type=\"number\"</kbd> - Цифрова клавіатура<br><kbd>type=\"tel\"</kbd> - Телефонна клавіатура",
			"task": "Створіть форму входу з двома полями:<br>1. Поле email: <kbd>&lt;label for=\"email\"&gt;Email:&lt;/label&gt;</kbd> та <kbd>&lt;input type=\"email\" id=\"email\"&gt;</kbd><br>2. Поле пароля: <kbd>&lt;label for=\"password\"&gt;Пароль:&lt;/label&gt;</kbd> та <kbd>&lt;input type=\"password\" id=\"password\"&gt;</kbd>",
			"previewHTML": "",
			"previewBaseCSS": "body { font-family: system-ui; padding: 20px; } form { max-width: 300px; } label { display: block; margin-top: 15px; margin-bottom: 5px; } label:first-child { margin-top: 0; } input { width: 100%; padding: 8px; border: 1px solid #ccc; border-radius: 4px; box-sizing: border-box; }",
			"sandboxCSS": "",
			"initialCode": "<form>\n  \n</form>",
			"solution": "<form>\n  <label for=\"email\">Email:</label>\n  <input type=\"email\" id=\"email\" name=\"email\">\n  \n  <label for=\"password\">Пароль:</label>\n  <input type=\"password\" id=\"password\" name=\"password\">\n</form>",
			"previewContainer": "preview-area",
			"validations": [
				{
					"type": "element_exists",
					"value": "input[type='email']",
					"message": "Додайте поле з type=\"email\""
				},
				{
					"type": "element_exists",
					"value": "input[type='password']",
					"message": "Додайте поле з type=\"password\""
				},
				{
					"type": "element_count",
					"value": { "selector": "label", "min": 2 },
					"message": "Додайте label для обох полів"
				}
			]
		},
		{
			"id": "submit-button",
			"title": "Кнопка відправки",
			"description": "Форми потребують способу відправки даних. Використовуйте:<br><br><kbd>&lt;button type=\"submit\"&gt;</kbd> - Переважно, гнучкий вміст<br><kbd>&lt;input type=\"submit\"&gt;</kbd> - Простий текстовий кнопка<br><br>Текст кнопки має бути орієнтованим на дію (напр. <code>Увійти</code>, 'Зареєструватись', 'Надіслати').",
			"task": "Додайте кнопку відправки до форми з текстом <code>Увійти</code>.",
			"previewHTML": "",
			"previewBaseCSS": "body { font-family: system-ui; padding: 20px; } form { max-width: 300px; } label { display: block; margin-top: 15px; margin-bottom: 5px; } label:first-child { margin-top: 0; } input { width: 100%; padding: 8px; border: 1px solid #ccc; border-radius: 4px; box-sizing: border-box; } button { width: 100%; margin-top: 20px; padding: 10px; background: #1976d2; color: white; border: none; border-radius: 4px; cursor: pointer; font-size: 16px; } button:hover { background: #1565c0; }",
			"sandboxCSS": "",
			"initialCode": "<form>\n  <label for=\"email\">Email:</label>\n  <input type=\"email\" id=\"email\">\n  \n  <label for=\"password\">Пароль:</label>\n  <input type=\"password\" id=\"password\">\n  \n</form>",
			"solution": "<form>\n  <label for=\"email\">Email:</label>\n  <input type=\"email\" id=\"email\">\n  \n  <label for=\"password\">Пароль:</label>\n  <input type=\"password\" id=\"password\">\n  \n  <button type=\"submit\">Увійти</button>\n</form>",
			"previewContainer": "preview-area",
			"validations": [
				{
					"type": "element_exists",
					"value": "button[type='submit'], input[type='submit']",
					"message": "Додайте кнопку відправки до форми"
				},
				{
					"type": "element_text",
					"value": { "selector": "button", "text": "Увійти" },
					"message": "Кнопка має відображати <kbd>Увійти</kbd>"
				}
			]
		}
	]
}
